{
  "schema": "eos-review-record/1",
  "id": "article/sender-constrained-tokens",
  "path": "src/content/blog/sender-constrained-tokens.mdx",
  "type": "article",
  "title": "Sender-Constrained Tokens: DPoP and Mutual TLS",
  "hash": "sha256:bd2c32837c65c4224d904d526cca3667492b188cef4da6f86c5f50db7051feb3",
  "reviewedAt": "2026-10-15",
  "commit": "8c3dd5b",
  "stages": {
    "developmental": "pass",
    "copy": "pass",
    "factCheck": "pass",
    "technical": "pass",
    "publishing": "pass",
    "qa": "pass"
  },
  "scores": {
    "purpose": 4,
    "structure": 4,
    "accuracy": 4,
    "evidence": 4,
    "language": 4,
    "consistency": 4,
    "publishing": 4
  },
  "critical": [],
  "findings": {
    "blocking": 0,
    "shouldFix": 0,
    "optional": 0,
    "open": 0
  },
  "lint": {
    "error": 0,
    "warning": 0,
    "suggestion": 1
  },
  "notVerified": [
    "RFC 8472 and RFC 8473 status (Proposed Standard) from the wave-1 check; only RFC 8471 re-fetched in wave 2",
    "RFC bibliographic entries were checked by wave 1 at rfc-editor.org and not re-fetched in wave 2 (consistent with the RFC index)"
  ],
  "changes": [
    "Wave 1: opening names RFC 8705 and RFC 9449 and the choice between them",
    "Wave 1: Token Binding reference no longer called historical (RFC 8471-8473 are Proposed Standard)",
    "Wave 1: References in house format (11 entries)"
  ],
  "reviewers": [
    "author (wave 1 revision and resolution)",
    "independent reviewer (fact-check, technical, series)",
    "QA editor (final gate)"
  ],
  "reportRef": "reviews/identity-and-access-control.md",
  "notes": "",
  "history": [],
  "total": 28,
  "decision": "publish",
  "problems": []
}
