{
  "schema": "eos-review-record/1",
  "id": "article/evaluating-models-honestly",
  "path": "src/content/blog/evaluating-models-honestly.mdx",
  "type": "article",
  "title": "Evaluating Models Honestly",
  "hash": "sha256:02d1067688ab210306818ac5dea50e845bedc6045902c89b03bc3634902d336c",
  "reviewedAt": "2026-10-15",
  "commit": "6a68449",
  "stages": {
    "developmental": "pass",
    "copy": "pass",
    "factCheck": "pass",
    "technical": "pass",
    "publishing": "pass",
    "qa": "pass"
  },
  "scores": {
    "purpose": 4,
    "structure": 4,
    "accuracy": 4,
    "evidence": 3,
    "language": 3,
    "consistency": 4,
    "publishing": 4
  },
  "critical": [],
  "findings": {
    "blocking": 0,
    "shouldFix": 3,
    "optional": 2,
    "open": 0
  },
  "lint": {
    "error": 0,
    "warning": 0,
    "suggestion": 4
  },
  "notVerified": [
    "Dietterich (1998) issue number 7: confirmed only by a secondary listing; MIT Press page not fetched",
    "Kaufman et al. (2012): page range not in the record consulted; entry gives only 'art. 15'"
  ],
  "changes": [
    "T3: label shift defined with P(x|y) fixed while P(y) changes; Section 5.1 sentences and paragraph split (:300-302)",
    "S1: standard error and 95% confidence interval defined before use (:320)",
    "F3: Stone (1974) attached at :110, Kaufman et al. (2012) at :186",
    "Q1: serial comma removed at :30, :78, :116, :239, :300, :302, :306, :333"
  ],
  "reviewers": [
    "author (wave 1 revision and resolution)",
    "independent reviewer (fact-check, technical, series)",
    "QA editor (final gate)"
  ],
  "reportRef": "reviews/machine-learning-fundamentals.md",
  "notes": "Language 3: two serial commas left in plain lists at :192 and :352 (Q3, optional, open). Evidence 3: Dietterich issue from a secondary listing, Kaufman et al. page range unavailable. sentence-length suggestion at :180 is a splitter artifact (justified in the wave-1 revision log). No Vietnamese translation exists.",
  "history": [],
  "total": 26,
  "decision": "publish",
  "problems": []
}
