{
  "schema": "eos-review-record/1",
  "id": "article/pid-control-of-process-variables",
  "path": "src/content/blog/pid-control-of-process-variables.mdx",
  "type": "article",
  "title": "PID Control of Process Variables",
  "hash": "sha256:16ad45edabbfafc748c4a65c30553a055727941fdeec8e073d7c3af16b3d318e",
  "reviewedAt": "2026-10-15",
  "commit": "4e54f90",
  "stages": {
    "developmental": "pass",
    "copy": "pass",
    "factCheck": "pass",
    "technical": "pass",
    "publishing": "pass",
    "qa": "pass"
  },
  "scores": {
    "purpose": 4,
    "structure": 4,
    "accuracy": 4,
    "evidence": 4,
    "language": 3,
    "consistency": 4,
    "publishing": 4
  },
  "critical": [],
  "findings": {
    "blocking": 0,
    "shouldFix": 0,
    "optional": 1,
    "open": 0
  },
  "lint": {
    "error": 0,
    "warning": 0,
    "suggestion": 11
  },
  "notVerified": [
    "Book editions of Astrom and Hagglund (2006), Seborg et al. (4th ed., 2016) and Shinskey (4th ed., 1996): consistent with reviewer knowledge, not fetched"
  ],
  "changes": [
    "Wave 1: description 392 -> 157 characters; headings to sentence case; PI and OPC UA expanded; Skogestad and Ziegler-Nichols references completed",
    "F3 (optional): unsourced 'in the great majority of loops' replaced by 'in most loops'"
  ],
  "reviewers": [
    "author (wave 1 revision and resolution)",
    "independent reviewer (fact-check, technical, series)",
    "QA editor (final gate)"
  ],
  "reportRef": "reviews/industrial-automation.md",
  "notes": "language 3: the closing transition (line 386) is one 66-word sentence. QA re-ran both blocks as one script (output identical).",
  "history": [],
  "total": 27,
  "decision": "publish",
  "problems": []
}
