{
  "schema": "eos-review-record/1",
  "id": "article/ensembles-and-approximate-bayesian-inference",
  "path": "src/content/blog/ensembles-and-approximate-bayesian-inference.mdx",
  "type": "article",
  "title": "Ensembles: Introduction and Connections with Approximate Bayesian Inference",
  "hash": "sha256:24580a82086544428fa5a058ba164adaecc52d98daf82eadbb8f66064073a01a",
  "reviewedAt": "2026-10-23",
  "commit": "1d927af",
  "stages": {
    "developmental": "pass",
    "copy": "pass",
    "factCheck": "pass",
    "technical": "pass",
    "publishing": "pass",
    "qa": "pass"
  },
  "scores": {
    "purpose": 4,
    "structure": 4,
    "accuracy": 4,
    "evidence": 3,
    "language": 4,
    "consistency": 4,
    "publishing": 4
  },
  "critical": [],
  "findings": {
    "blocking": 0,
    "shouldFix": 0,
    "optional": 0,
    "open": 0
  },
  "lint": {
    "error": 0,
    "warning": 2,
    "suggestion": 4
  },
  "notVerified": [
    "Running prose wording beyond the mechanical coverage check and page-by-page read (no character-level diff)",
    "Scientific correctness of the book's own claims (kept as written by design)",
    "Figures 19.1 and 19.2 are schematic reproductions (curves and regression data synthetic); Figure 19.3 bar heights are approximate values read off the original",
    "Empirical claims attributed to Izmailov et al., Wilson and Izmailov and the Wilson et al. competition (337 submissions, 12 teams) not verifiable after citation removal"
  ],
  "changes": [
    "Full text of the book chapter converted to MDX: citation markers removed at the owner's request, house copyedit (American spelling, no contractions, sentence-case headings), figures redrawn as generated SVG",
    "Independent fidelity QA against the PDF: completeness, every display equation, algorithm and table checked; defects fixed",
    "First-person voice rewritten into neutral voice at the owner's decision (no note added); claims, numbers and order unchanged"
  ],
  "reviewers": [
    "converter (full-text conversion)",
    "independent QA editor (fidelity check against the PDF)"
  ],
  "reportRef": null,
  "notes": "Publication of ACRR's own book chapter in full (owner's instruction, 2026-10-22). Developmental and fact-check stages assess fidelity to the source text, not the book's own claims; likely errors in the book are kept as written and listed for the owner.",
  "history": [],
  "total": 27,
  "decision": "publish",
  "problems": []
}
