{
  "schema": "eos-review-record/1",
  "id": "article/laplace-introduction",
  "path": "src/content/blog/laplace-introduction.mdx",
  "type": "article",
  "title": "Laplace Approximations: Introduction",
  "hash": "sha256:18fef285b4a729f09ef35427c8e9d5d33c92b19a886f45e7fdc9fe7b97aa9abc",
  "reviewedAt": "2026-10-23",
  "commit": "d877501",
  "stages": {
    "developmental": "pass",
    "copy": "pass",
    "factCheck": "pass",
    "technical": "pass",
    "publishing": "pass",
    "qa": "pass"
  },
  "scores": {
    "purpose": 4,
    "structure": 4,
    "accuracy": 4,
    "evidence": 3,
    "language": 4,
    "consistency": 4,
    "publishing": 4
  },
  "critical": [],
  "findings": {
    "blocking": 0,
    "shouldFix": 0,
    "optional": 0,
    "open": 0
  },
  "lint": {
    "error": 0,
    "warning": 4,
    "suggestion": 11
  },
  "notVerified": [
    "Running prose wording beyond the mechanical coverage check and page-by-page read (no character-level diff)",
    "Scientific correctness of the book's own claims (kept as written by design)",
    "Figure 7.1 cannot be reproduced from the caption's stated setup; redraw uses a substitute model (tanh, targets (1, -1)) and its own GGN ellipses, which are smaller and less tilted than the original's; contour labels reduced to two"
  ],
  "changes": [
    "Full text of the book chapter converted to MDX: citation markers removed at the owner's request, house copyedit (American spelling, no contractions, sentence-case headings), figures redrawn as generated SVG",
    "Independent fidelity QA against the PDF: completeness, every display equation, algorithm and table checked; defects fixed",
    "First-person voice rewritten into neutral voice at the owner's decision (no note added); claims, numbers and order unchanged",
    "Emphasis markup inside words or italic passages adjusted so the rendered text is not glued (rendering only, wording unchanged)"
  ],
  "reviewers": [
    "converter (full-text conversion)",
    "independent QA editor (fidelity check against the PDF)"
  ],
  "reportRef": null,
  "notes": "Publication of ACRR's own book chapter in full (owner's instruction, 2026-10-22). Developmental and fact-check stages assess fidelity to the source text, not the book's own claims; likely errors in the book are kept as written and listed for the owner. The one open QA observation (Figure 7.1 redrawn with a substitute model because the caption's stated setup cannot produce the plotted landscape) is disclosed in the caption and listed for the owner, so no finding remains open.",
  "history": [
    {
      "reviewedAt": "2026-10-23",
      "hash": "sha256:aac06f69c0ffe7f5221aaf4bb86826eb1c55e0a18e99d8aa1248a173ca262b26",
      "decision": "publish",
      "total": 27,
      "commit": "d877501"
    }
  ],
  "total": 27,
  "decision": "publish",
  "problems": []
}
