{
  "schema": "eos-review-record/1",
  "id": "article/authorization-models",
  "path": "src/content/blog/authorization-models.mdx",
  "type": "article",
  "title": "Authorization Models: RBAC, ABAC and Relationship-Based Access",
  "hash": "sha256:c38693faec96c13eb598ffe576c29cbda3f7136e8903f1b4058183423c877e7b",
  "reviewedAt": "2026-10-15",
  "commit": "8c3dd5b",
  "stages": {
    "developmental": "pass",
    "copy": "pass",
    "factCheck": "pass",
    "technical": "pass",
    "publishing": "pass",
    "qa": "pass"
  },
  "scores": {
    "purpose": 4,
    "structure": 4,
    "accuracy": 4,
    "evidence": 4,
    "language": 3,
    "consistency": 4,
    "publishing": 4
  },
  "critical": [],
  "findings": {
    "blocking": 0,
    "shouldFix": 0,
    "optional": 2,
    "open": 0
  },
  "lint": {
    "error": 0,
    "warning": 0,
    "suggestion": 10
  },
  "notVerified": [
    "Title of the 2004 edition of INCITS 359 assumed identical to the 2012 title checked on webstore.ansi.org"
  ],
  "changes": [
    "F3: Bell and LaPadula (1973) and Biba (1977) added to References",
    "S2: link to Section 4.3 of the first entry in Section 6.1",
    "Wave 1: duplicate headings renamed; abbreviations expanded; References in house format with volume, issue and pages"
  ],
  "reviewers": [
    "author (wave 1 revision and resolution)",
    "independent reviewer (fact-check, technical, series)",
    "QA editor (final gate)"
  ],
  "reportRef": "reviews/identity-and-access-control.md",
  "notes": "Language 3: a few serial commas against standards 5.1 (eos serial-comma suggestions; QA spot-check confirmed genuine lapses), e.g. line 167.",
  "history": [],
  "total": 27,
  "decision": "publish",
  "problems": []
}
