{
  "schema": "eos-review-record/1",
  "id": "article/state-space-models-primer",
  "path": "src/content/blog/state-space-models-primer.mdx",
  "type": "article",
  "title": "A Primer on State-Space Models",
  "hash": "sha256:44be66e21c414b4c3b1f3e8c03298b556907078d66ec6ad0943aeb30ebffe6b8",
  "reviewedAt": "2026-10-15",
  "commit": "2e79a4b",
  "stages": {
    "developmental": "pass",
    "copy": "pass",
    "factCheck": "pass",
    "technical": "pass",
    "publishing": "pass",
    "qa": "pass"
  },
  "scores": {
    "purpose": 4,
    "structure": 4,
    "accuracy": 4,
    "evidence": 3,
    "language": 3,
    "consistency": 4,
    "publishing": 4
  },
  "critical": [],
  "findings": {
    "blocking": 0,
    "shouldFix": 1,
    "optional": 2,
    "open": 0
  },
  "lint": {
    "error": 0,
    "warning": 0,
    "suggestion": 0
  },
  "notVerified": [
    "Exact chapter/page in each textbook for each claim: books not accessible; the claims are standard textbook content"
  ],
  "changes": [
    "Wave 1: defined the state, the coordinate change z = Tx with eigenvalue invariance, the matrix exponential, and the input-output and state-space forms of the mass-spring-damper side by side",
    "T2: transfer function to state space now names both coordinate changes and added hidden states as sources of non-uniqueness",
    "Optional T3: growing oscillation only while c^2 < 4mk; T4: complex eigenvector handled via Re v, 'a sum of modes'"
  ],
  "reviewers": [
    "author (wave 1 revision and resolution)",
    "independent reviewer (fact-check, technical, series)",
    "QA editor (final gate)"
  ],
  "reportRef": "reviews/foundations-of-control-systems.md",
  "notes": "Evidence 3: references are complete and verified, but no claim cites a chapter or section of a textbook, and chapter-level support was not checked. Language 3: the T4 sentence 'does not decay either' precedes the sentence it echoes, so the Section 4.1 argument reads slightly out of order. Vietnamese translation marked for update.",
  "history": [],
  "total": 26,
  "decision": "publish",
  "problems": []
}
