{
  "schema": "eos-review-record/1",
  "id": "article/evaluating-and-using-uncertainty",
  "path": "src/content/blog/evaluating-and-using-uncertainty.mdx",
  "type": "article",
  "title": "Evaluating and Using Predictive Uncertainty",
  "hash": "sha256:cea65b1f6887c2746d3dc0d53ab70d9943c67753fe24fbcd514f520dc35fda86",
  "reviewedAt": "2026-10-23",
  "commit": "aaacbc4",
  "stages": {
    "developmental": "pass",
    "copy": "pass",
    "factCheck": "pass",
    "technical": "pass",
    "publishing": "pass",
    "qa": "pass"
  },
  "scores": {
    "purpose": 4,
    "structure": 4,
    "accuracy": 4,
    "evidence": 3,
    "language": 4,
    "consistency": 4,
    "publishing": 4
  },
  "critical": [],
  "findings": {
    "blocking": 0,
    "shouldFix": 2,
    "optional": 4,
    "open": 0
  },
  "lint": {
    "error": 0,
    "warning": 0,
    "suggestion": 2
  },
  "notVerified": [
    "Bibliographic details recalled rather than checked against the publications (pages omitted where unknown; none invented)",
    "Kadavath et al. (2022), Kuhn et al. (2023), Shen et al. (2024) and Yang et al. (2024) results as summarized"
  ],
  "changes": [
    "Resolved every blocking and should-fix finding of the independent reviews; see the report",
    "Series restructured for the full book chapters: seriesOrder changed; references to other entries by position replaced with references by Part; closing paragraph now points to the chapters that follow (mechanical, meaning unchanged)",
    "seriesOrder shifted by five for Part II (Chapters 7 to 11); text unchanged",
    "seriesOrder shifted by seven for Part III (Chapters 12 to 18); text unchanged",
    "seriesOrder shifted by four for Part IV (Chapters 19 to 22); text unchanged",
    "seriesOrder shifted by five for Part V (Chapters 23 to 27); text unchanged"
  ],
  "reviewers": [
    "author (drafting and resolution)",
    "independent reviewers (first wave: developmental, copy, fact-check, technical)",
    "independent series reviewer (second pass)",
    "independent QA verifier (third pass, final gate)"
  ],
  "reportRef": "reviews/bayesian-deep-learning.md",
  "notes": "",
  "history": [
    {
      "reviewedAt": "2026-10-21",
      "hash": "sha256:7cf8f0560f8e240299c61ca14bf16f3351882e5ff5196010264a058664d5c93d",
      "decision": "publish",
      "total": 27,
      "commit": "ae8d3c0"
    },
    {
      "reviewedAt": "2026-10-22",
      "hash": "sha256:b2c6bdd1c6b4296899e55f4cb5bc809f314076bce537793df520463184a16c63",
      "decision": "publish",
      "total": 27,
      "commit": "cc30b8c"
    },
    {
      "reviewedAt": "2026-10-23",
      "hash": "sha256:5d9ed928a2e2d30c5469201eaa9ce81f0ba9dfdbed79cff8d7d2ef1e9216aee9",
      "decision": "publish",
      "total": 27,
      "commit": "d877501"
    },
    {
      "reviewedAt": "2026-10-23",
      "hash": "sha256:c9a6d57046ec00ba5a747c959f2f73ef6e28f6d9a06c477667dcaaac4b1cd59b",
      "decision": "publish",
      "total": 27,
      "commit": "79b820a"
    },
    {
      "reviewedAt": "2026-10-23",
      "hash": "sha256:bae081bb598c7016ce38c5158c99e4b454eaa329a1e2b1eff31ecba302960b49",
      "decision": "publish",
      "total": 27,
      "commit": "1d927af"
    }
  ],
  "total": 27,
  "decision": "publish",
  "problems": []
}
