{
  "schema": "eos-review-record/1",
  "id": "series/digital-signal-processing",
  "path": "src/content/series/digital-signal-processing.md",
  "type": "series",
  "title": "Digital Signal Processing for Engineers",
  "hash": "sha256:75fa407b1247c1fb1966ba80cd3cbbf0365f8e4af7a8eac9fdf5b7c1b79bb436",
  "reviewedAt": "2026-10-15",
  "commit": "4e54f90",
  "stages": {
    "developmental": "pass",
    "copy": "pass",
    "series": "pass",
    "publishing": "pass",
    "qa": "pass"
  },
  "scores": {
    "purpose": 3,
    "structure": 4,
    "accuracy": 4,
    "evidence": 4,
    "language": 4,
    "consistency": 4,
    "publishing": 4
  },
  "critical": [],
  "findings": {
    "blocking": 0,
    "shouldFix": 1,
    "optional": 1,
    "open": 0
  },
  "lint": {
    "error": 0,
    "warning": 0,
    "suggestion": 1
  },
  "notVerified": [],
  "changes": [
    "S1: prerequisite sentence added (Laplace transform, s-plane poles, feedback vocabulary, linking Introduction to Control Systems)",
    "S5: conventions sentence corrected (notation table, sign convention, systems at rest)"
  ],
  "reviewers": [
    "author (wave 1 revision and resolution)",
    "independent reviewer (fact-check, technical, series)",
    "QA editor (final gate)"
  ],
  "reportRef": "reviews/digital-signal-processing.md",
  "notes": "Series stage: independent series review in reviews/digital-signal-processing.md; all five objectives met. Purpose 3: two objectives begin with 'Use' and 'Treat', weaker verbs than standards 6.5 suggests (optional, not raised as should-fix). The Vietnamese series file still needs the S1/S5 prose update; outside this English verdict.",
  "history": [],
  "total": 27,
  "decision": "publish",
  "problems": []
}
