{
  "schema": "eos-review-record/1",
  "id": "article/scaling-bayesian-deep-learning",
  "path": "src/content/blog/scaling-bayesian-deep-learning.mdx",
  "type": "article",
  "title": "Scaling Bayesian Deep Learning",
  "hash": "sha256:75c6dfeea5363fdfc51f49448baf00d2420a3db98df36780d075fcea44d2848d",
  "reviewedAt": "2026-10-22",
  "commit": "cc30b8c",
  "stages": {
    "developmental": "pass",
    "copy": "pass",
    "factCheck": "pass",
    "technical": "pass",
    "publishing": "pass",
    "qa": "pass"
  },
  "scores": {
    "purpose": 4,
    "structure": 4,
    "accuracy": 4,
    "evidence": 3,
    "language": 4,
    "consistency": 3,
    "publishing": 4
  },
  "critical": [],
  "findings": {
    "blocking": 0,
    "shouldFix": 2,
    "optional": 3,
    "open": 0
  },
  "lint": {
    "error": 0,
    "warning": 0,
    "suggestion": 3
  },
  "notVerified": [
    "Bibliographic details recalled rather than checked against the publications (pages omitted where unknown; none invented)",
    "SWAG memory row ('P to (r + 2)P') of the cost table",
    "Pages of Honkela and Valpola (2004)",
    "Maddox et al. (2019) author order recalled, not checked against the paper"
  ],
  "changes": [
    "Resolved every blocking and should-fix finding of the independent reviews; see the report",
    "Series restructured for the full book chapters: seriesOrder changed; references to other entries by position replaced with references by Part; closing paragraph now points to the chapters that follow (mechanical, meaning unchanged)"
  ],
  "reviewers": [
    "author (drafting and resolution)",
    "independent reviewers (first wave: developmental, copy, fact-check, technical)",
    "independent series reviewer (second pass)",
    "independent QA verifier (third pass, final gate)"
  ],
  "reportRef": "reviews/bayesian-deep-learning.md",
  "notes": "Third-pass optional T2 (ln vs log) applied after the QA scores were set.",
  "history": [
    {
      "reviewedAt": "2026-10-21",
      "hash": "sha256:dae7614efa32ca27a7af4972928b68ed938b89c7b6de25455d2b8416d3982783",
      "decision": "publish",
      "total": 26,
      "commit": "ae8d3c0"
    }
  ],
  "total": 26,
  "decision": "publish",
  "problems": []
}
