{
  "schema": "eos-review-record/1",
  "id": "article/model-selection-with-the-marginal-likelihood",
  "path": "src/content/blog/model-selection-with-the-marginal-likelihood.mdx",
  "type": "article",
  "title": "Model Selection with the Marginal Likelihood",
  "hash": "sha256:21d8bd1fa2679631b575f9dbc571a437ceba7dffb4b5974b7e86c19d2b45913e",
  "reviewedAt": "2026-10-23",
  "commit": "d877501",
  "stages": {
    "developmental": "pass",
    "copy": "pass",
    "factCheck": "pass",
    "technical": "pass",
    "publishing": "pass",
    "qa": "pass"
  },
  "scores": {
    "purpose": 4,
    "structure": 4,
    "accuracy": 4,
    "evidence": 3,
    "language": 4,
    "consistency": 4,
    "publishing": 4
  },
  "critical": [],
  "findings": {
    "blocking": 0,
    "shouldFix": 0,
    "optional": 0,
    "open": 0
  },
  "lint": {
    "error": 0,
    "warning": 7,
    "suggestion": 42
  },
  "notVerified": [
    "Running prose wording beyond the mechanical coverage check and page-by-page read (no character-level diff)",
    "Scientific correctness of the book's own claims (kept as written by design)",
    "Figure 11.2 training curves and probability maps are illustrative, not the original results (stated in caption)"
  ],
  "changes": [
    "Full text of the book chapter converted to MDX: citation markers removed at the owner's request, house copyedit (American spelling, no contractions, sentence-case headings), figures redrawn as generated SVG",
    "Independent fidelity QA against the PDF: completeness, every display equation, algorithm and table checked; defects fixed",
    "First-person voice rewritten into neutral voice at the owner's decision (no note added); claims, numbers and order unchanged"
  ],
  "reviewers": [
    "converter (full-text conversion)",
    "independent QA editor (fidelity check against the PDF)"
  ],
  "reportRef": null,
  "notes": "Publication of ACRR's own book chapter in full (owner's instruction, 2026-10-22). Developmental and fact-check stages assess fidelity to the source text, not the book's own claims; likely errors in the book are kept as written and listed for the owner.",
  "history": [],
  "total": 27,
  "decision": "publish",
  "problems": []
}
