{
  "schema": "eos-review-record/1",
  "id": "insight/control-vs-learning-approaches",
  "path": "src/content/insights/control-vs-learning-approaches.md",
  "type": "insight",
  "title": "Model-Based Control and Learned Policies",
  "hash": "sha256:097a2b23794448d44212d8a685a4694ea84b169e66b69fdec5a9d58a4aa93869",
  "reviewedAt": "2026-10-15",
  "commit": "6c5490f",
  "stages": {
    "developmental": "pass",
    "copy": "pass",
    "factCheck": "pass",
    "technical": "pass",
    "publishing": "pass",
    "qa": "pass"
  },
  "scores": {
    "purpose": 4,
    "structure": 4,
    "accuracy": 4,
    "evidence": 3,
    "language": 4,
    "consistency": 4,
    "publishing": 4
  },
  "critical": [],
  "findings": {
    "blocking": 0,
    "shouldFix": 1,
    "optional": 0,
    "open": 0
  },
  "lint": {
    "error": 0,
    "warning": 0,
    "suggestion": 0
  },
  "notVerified": [],
  "changes": [
    "Established: gain and phase margins now defined as tolerance to extra loop gain or extra phase lag in a single-input single-output loop, one kind of error at a time (T3)",
    "Wave 1 revision of framing and the three sections; links to the control series, the state-feedback entry and the sim-to-real insight"
  ],
  "reviewers": [
    "author (wave 1 revision and resolution)",
    "independent reviewer (fact-check, technical, series)",
    "QA editor (final gate)"
  ],
  "reportRef": "editorial/audit/review/standalone.md",
  "notes": "QA scores: evidence 3 because the Established claims about learning-based methods (data cost, weaker guarantees) rest on common knowledge without a source.",
  "history": [],
  "total": 27,
  "decision": "publish",
  "problems": []
}
