{
  "schema": "eos-review-record/1",
  "id": "article/distributed-memory-and-message-passing",
  "path": "src/content/blog/distributed-memory-and-message-passing.mdx",
  "type": "article",
  "title": "Distributed Memory and Message Passing",
  "hash": "sha256:67bef8fd82e263411676fd89dcc4c2393c67b549acdf140850dd65f6ca3f7173",
  "reviewedAt": "2026-10-16",
  "commit": "15ba49a",
  "stages": {
    "developmental": "pass",
    "copy": "pass",
    "factCheck": "pass",
    "technical": "pass",
    "publishing": "pass",
    "qa": "pass"
  },
  "scores": {
    "purpose": 4,
    "structure": 4,
    "accuracy": 3,
    "evidence": 4,
    "language": 4,
    "consistency": 4,
    "publishing": 4
  },
  "critical": [],
  "findings": {
    "blocking": 0,
    "shouldFix": 13,
    "optional": 11,
    "open": 0
  },
  "lint": {
    "error": 0,
    "warning": 0,
    "suggestion": 8
  },
  "notVerified": [
    "Every reference-machine timing (ping-pong, fits, allreduce 1.11 us, Jacobi runs, the 1.95 s and 2.5x subnormal run, per-rank 0.56-0.65 s): the reference VM is no longer available (the container now runs on a different host); the text presents them as measurements of that stated machine only, and the reviewers re-ran every deterministic output (model.out, collectives.out, fit of the saved ping-pong data, bitwise grid comparisons, subnormal counts).",
    "Full text of Thakur, Rabenseifner and Gropp (2005), Patarasuk and Yuan (2009) and Culler et al. (1993): not fetched (no network access to the papers); bibliographic details confirmed from catalogues and the cost formulas verified by derivation.",
    "'Repeated runs differed by up to about 15% for the largest messages' (Section 3.2): a statement about the writer's session with no kept record; the technical reviewer's reruns on another host were consistent in magnitude.",
    "Series review stamp: reviews/parallel-and-high-performance-computing.md is resolved but not yet stamped (series-pipeline status 'review-stale'); C9 is enforced by series-pipeline gate after stamp."
  ],
  "changes": [
    "D1/D2: opening second paragraph rewritten as a line of argument; closing of Section 8 rewritten to meet the fifth objective without overclaiming",
    "C1-C4: serial commas removed, seven long sentences split, imprecise phrasings replaced",
    "D3/T1: Section 2.4 states the sizes tried (1 to 1,000,000 doubles, including 505 and 506); sweep added to run.sh",
    "D4/F1: MPI 5.0 (2025) cited and added to the References; F2: Patarasuk and Yuan issue number added; F3: 'their semantics are unchanged'; F4: ring allreduce attributed to Patarasuk and Yuan",
    "D5/T2: Gustafson check uses unrounded values, 3974.24 against 3974.22, differing by exactly f_s (recomputed by QA: 3974.245 vs 3974.215)",
    "C5/T3: Summary row now says global sums agree within the rounding error of a reordered sum (2.6e-13 relative)",
    "T4: unsupported '0.65 s in an earlier session' replaced by the spread of the quoted runs; T5: alpha ~ L + 2o, no counterpart of the gap; T6: subnormal band up to about 23,000 points (2.3%)",
    "T7, T8 (optional): rounding remainder 2.4e-10 stated; eager-range bandwidth flagged as least repeatable",
    "Series review F1: 'reported at 2.1 GHz'; F6: row width written as N + 2 values (the variable W in the code); F13: f_s defined 'by analogy with Gustafson's serial fraction'"
  ],
  "reviewers": [
    "developmental and copy editor (independent agent)",
    "fact-checker and technical reviewer (independent agent)",
    "series editor (independent agent)",
    "author (resolution)",
    "qa-editor (independent agent)"
  ],
  "reportRef": "editorial/audit/items/distributed-memory-and-message-passing.md",
  "notes": "Accuracy 3: every equation, table and exercise recomputes (QA recomputed the strong- and weak-scaling rows, the Gustafson check, Exercise 4, the allreduce estimate, n_1/2 and the change-norm differences), but the Conventions sentence 'each quoted time is the median of several repetitions' (line 18) is not literally true of the individual runs quoted in Section 5.3 or of the single 1.95 s run in that section; optional Q1, the qualification could be sharper. Open counts unresolved blocking and should-fix findings; optional D6 (heading of 5.3) and Q1 remain as optional. Lint: 0 errors, 0 warnings, 8 suggestions, each justified in the copy section (C6) or, for the 47-word sentence at line 273 added by F4, a single attribution sentence.",
  "history": [],
  "total": 27,
  "decision": "publish",
  "problems": []
}
