{
  "schema": "eos-review-record/1",
  "id": "article/networked-automation-and-digital-twins",
  "path": "src/content/blog/networked-automation-and-digital-twins.mdx",
  "type": "article",
  "title": "Networked Automation and Digital Twins",
  "hash": "sha256:e4beafe39f318fa56412bd6666cfc4d87169abf8e222d86477ef79107ae4e6ef",
  "reviewedAt": "2026-10-15",
  "commit": "4e54f90",
  "stages": {
    "developmental": "pass",
    "copy": "pass",
    "factCheck": "pass",
    "technical": "pass",
    "publishing": "pass",
    "qa": "pass"
  },
  "scores": {
    "purpose": 4,
    "structure": 4,
    "accuracy": 4,
    "evidence": 3,
    "language": 3,
    "consistency": 4,
    "publishing": 4
  },
  "critical": [],
  "findings": {
    "blocking": 0,
    "shouldFix": 1,
    "optional": 1,
    "open": 0
  },
  "lint": {
    "error": 0,
    "warning": 0,
    "suggestion": 32
  },
  "notVerified": [
    "Bibliographic details of Kritzinger et al. (2018) and Mahnke et al. (2009), OPC UA and MQTT protocol constants: consistent with reviewer knowledge, not fetched"
  ],
  "changes": [
    "Wave 1: closing paragraph maps the series to its five objectives; description 392 -> 151 characters; headings to sentence case; Kritzinger et al. completed",
    "T1: Exercise 4 answer says the smaller gain enlarges the fault signature by about 70% (4.6 to 8 mm) instead of doubling it (QA recomputed: factor 1.72, L = 0.0274)",
    "T3 (optional): time-step index in Section 5.6 renamed from k to j"
  ],
  "reviewers": [
    "author (wave 1 revision and resolution)",
    "independent reviewer (fact-check, technical, series)",
    "QA editor (final gate)"
  ],
  "reportRef": "reviews/industrial-automation.md",
  "notes": "evidence 3: IEC 62264-1, IEC 62443, IEC 62541 and ISO 23247 are cited without a year. language 3: several long sentences remain (closing paragraph line 341: 61 and 53 words). QA re-ran the leak program (output identical).",
  "history": [],
  "total": 26,
  "decision": "publish",
  "problems": []
}
