{
  "schema": "eos-review-record/1",
  "id": "article/gaussian-processes-and-kernels",
  "path": "src/content/blog/gaussian-processes-and-kernels.mdx",
  "type": "article",
  "title": "Gaussian Processes, Kernels and Infinitely Wide Networks",
  "hash": "sha256:e0cf714b30ba474e2a05c9bcd4094b9cd4828ed5158ab46b3469404a5b7ec7cd",
  "reviewedAt": "2026-10-23",
  "commit": "d877501",
  "stages": {
    "developmental": "pass",
    "copy": "pass",
    "factCheck": "pass",
    "technical": "pass",
    "publishing": "pass",
    "qa": "pass"
  },
  "scores": {
    "purpose": 4,
    "structure": 4,
    "accuracy": 4,
    "evidence": 3,
    "language": 4,
    "consistency": 4,
    "publishing": 4
  },
  "critical": [],
  "findings": {
    "blocking": 1,
    "shouldFix": 2,
    "optional": 2,
    "open": 0
  },
  "lint": {
    "error": 0,
    "warning": 0,
    "suggestion": 3
  },
  "notVerified": [
    "Bibliographic details recalled rather than checked against the publications (pages omitted where unknown; none invented)",
    "Lee et al. (2018) and Arora et al. (2019) empirical results as summarized"
  ],
  "changes": [
    "Resolved every blocking and should-fix finding of the independent reviews; see the report",
    "Series restructured for the full book chapters: seriesOrder changed; references to other entries by position replaced with references by Part; closing paragraph now points to the chapters that follow (mechanical, meaning unchanged)",
    "seriesOrder shifted by five for Part II (Chapters 7 to 11); text unchanged"
  ],
  "reviewers": [
    "author (drafting and resolution)",
    "independent reviewers (first wave: developmental, copy, fact-check, technical)",
    "independent series reviewer (second pass)",
    "independent QA verifier (third pass, final gate)"
  ],
  "reportRef": "reviews/bayesian-deep-learning.md",
  "notes": "",
  "history": [
    {
      "reviewedAt": "2026-10-21",
      "hash": "sha256:0c0cf94019b0ac24468bbd142338ca9b22c73d62b1b45c850037251080480736",
      "decision": "publish",
      "total": 27,
      "commit": "ae8d3c0"
    },
    {
      "reviewedAt": "2026-10-22",
      "hash": "sha256:62e9760a76d1f7aacb6b55175c23730b151ced79c676a2422e98bd8b04aff6e3",
      "decision": "publish",
      "total": 27,
      "commit": "cc30b8c"
    }
  ],
  "total": 27,
  "decision": "publish",
  "problems": []
}
