{
  "schema": "eos-review-record/1",
  "id": "series/sensor-systems",
  "path": "src/content/series/sensor-systems.md",
  "type": "series",
  "title": "Sensor Systems",
  "hash": "sha256:088cd205362aa64d00107415fd141046e443b0301f877f5ddb69187429fefe23",
  "reviewedAt": "2026-10-15",
  "commit": "bc55aaa",
  "stages": {
    "developmental": "pass",
    "copy": "pass",
    "factCheck": "pass",
    "technical": "pass",
    "publishing": "pass",
    "qa": "pass",
    "series": "pass"
  },
  "scores": {
    "purpose": 4,
    "structure": 4,
    "accuracy": 4,
    "evidence": 4,
    "language": 4,
    "consistency": 3,
    "publishing": 4
  },
  "critical": [],
  "findings": {
    "blocking": 0,
    "shouldFix": 2,
    "optional": 1,
    "open": 0
  },
  "lint": {
    "error": 0,
    "warning": 0,
    "suggestion": 1
  },
  "notVerified": [],
  "changes": [
    "Wave 1: body rewritten to state reader and prerequisites, sequence rationale, the two running examples and shared conventions; description rewritten (158 characters)",
    "S1: 'build that chain on one chip' -> 'in a single package', matching entry 6 section 4",
    "S3: 'Noise figures' -> 'Noise voltages and currents are root-mean-square values, computed at 300 K'",
    "S6: units sentence now names multiples of standard gravity and mV/V"
  ],
  "reviewers": [
    "author (wave 1 revision and resolution)",
    "independent reviewer (fact-check, technical, series)",
    "QA editor (final gate)"
  ],
  "reportRef": "reviews/sensor-systems.md",
  "notes": "Consistency 3: the overview writes 'the standard gravity *g*' (italic) while entry 7 uses $g_n$ for standard gravity and the entries use upright g as a unit (mg, µg/√Hz); minor. factCheck and technical covered by the independent series review. The Vietnamese overview still carries pre-wave-1 text and the S1/S3/S6 meaning changes; outside this verdict.",
  "history": [],
  "total": 27,
  "decision": "publish",
  "problems": []
}
