{
  "schema": "eos-review-record/1",
  "id": "article/introduction-to-control-systems",
  "path": "src/content/blog/introduction-to-control-systems.mdx",
  "type": "article",
  "title": "Introduction to Control Systems",
  "hash": "sha256:b5fc1e388b484895b43a53a7fbf6472d9d8f37cc775b21ca174eafd6b362714c",
  "reviewedAt": "2026-10-15",
  "commit": "2e79a4b",
  "stages": {
    "developmental": "pass",
    "copy": "pass",
    "factCheck": "pass",
    "technical": "pass",
    "publishing": "pass",
    "qa": "pass"
  },
  "scores": {
    "purpose": 4,
    "structure": 4,
    "accuracy": 4,
    "evidence": 3,
    "language": 4,
    "consistency": 4,
    "publishing": 4
  },
  "critical": [],
  "findings": {
    "blocking": 0,
    "shouldFix": 0,
    "optional": 0,
    "open": 0
  },
  "lint": {
    "error": 0,
    "warning": 0,
    "suggestion": 0
  },
  "notVerified": [
    "Exact chapter/page in each textbook for each claim: books not accessible; the claims are standard textbook content"
  ],
  "changes": [
    "Wave 1: numbered sections; defined linearity, time invariance and LTI; introduced the Laplace transform with the derivative rule; added a worked first-order transfer function, the step-response derivation (peak exact, settling time an estimate) and the overshoot/settling table recomputed by scanning the analytic response"
  ],
  "reviewers": [
    "author (wave 1 revision and resolution)",
    "independent reviewer (fact-check, technical, series)",
    "QA editor (final gate)"
  ],
  "reportRef": "reviews/foundations-of-control-systems.md",
  "notes": "Evidence 3: references are complete and verified, but no claim cites a chapter or section of a textbook, and chapter-level support was not checked. Vietnamese translation marked for update.",
  "history": [],
  "total": 27,
  "decision": "publish",
  "problems": []
}
