{
  "schema": "eos-review-record/1",
  "id": "article/differential-geometric-perspective-on-laplace",
  "path": "src/content/blog/differential-geometric-perspective-on-laplace.mdx",
  "type": "article",
  "title": "The Differential Geometric Perspective on Laplace",
  "hash": "sha256:cc54ac672e7f16226e362c88a1566ee913e8774a0fb1464fe0b4d6711a9ba2ef",
  "reviewedAt": "2026-10-23",
  "commit": "d877501",
  "stages": {
    "developmental": "pass",
    "copy": "pass",
    "factCheck": "pass",
    "technical": "pass",
    "publishing": "pass",
    "qa": "pass"
  },
  "scores": {
    "purpose": 4,
    "structure": 4,
    "accuracy": 4,
    "evidence": 3,
    "language": 4,
    "consistency": 4,
    "publishing": 4
  },
  "critical": [],
  "findings": {
    "blocking": 0,
    "shouldFix": 0,
    "optional": 0,
    "open": 0
  },
  "lint": {
    "error": 0,
    "warning": 5,
    "suggestion": 5
  },
  "notVerified": [
    "Running prose wording beyond the mechanical coverage check and page-by-page read (no character-level diff)",
    "Scientific correctness of the book's own claims (kept as written by design)",
    "'The latter work uses the Fisher' became 'Later work uses the Fisher' because the citation pair it pointed to was removed (minimal repair)"
  ],
  "changes": [
    "Full text of the book chapter converted to MDX: citation markers removed at the owner's request, house copyedit (American spelling, no contractions, sentence-case headings), figures redrawn as generated SVG",
    "Independent fidelity QA against the PDF: completeness, every display equation, algorithm and table checked; defects fixed",
    "First-person voice rewritten into neutral voice at the owner's decision (no note added); claims, numbers and order unchanged"
  ],
  "reviewers": [
    "converter (full-text conversion)",
    "independent QA editor (fidelity check against the PDF)"
  ],
  "reportRef": null,
  "notes": "Publication of ACRR's own book chapter in full (owner's instruction, 2026-10-22). Developmental and fact-check stages assess fidelity to the source text, not the book's own claims; likely errors in the book are kept as written and listed for the owner.",
  "history": [],
  "total": 27,
  "decision": "publish",
  "problems": []
}
