{
  "schema": "eos-review-record/1",
  "id": "series/industrial-automation",
  "path": "src/content/series/industrial-automation.md",
  "type": "series",
  "title": "Industrial Automation",
  "hash": "sha256:4ae34d3327f23f9c4a4f0a8f7b4e07a2f021858b827342c0543764f730007ac1",
  "reviewedAt": "2026-10-15",
  "commit": "4e54f90",
  "stages": {
    "developmental": "pass",
    "copy": "pass",
    "factCheck": "pass",
    "technical": "pass",
    "publishing": "pass",
    "qa": "pass",
    "series": "pass"
  },
  "scores": {
    "purpose": 4,
    "structure": 4,
    "accuracy": 4,
    "evidence": 4,
    "language": 4,
    "consistency": 4,
    "publishing": 4
  },
  "critical": [],
  "findings": {
    "blocking": 0,
    "shouldFix": 0,
    "optional": 2,
    "open": 0
  },
  "lint": {
    "error": 0,
    "warning": 0,
    "suggestion": 3
  },
  "notVerified": [
    "src/content/series/industrial-automation.md:18 - removal of Instruction List by IEC 61131-3:2025: Annex B not accessible; the sentence now says only that the published scope of the 2025 edition no longer lists Instruction List (IEC-derived AFNOR abstract)"
  ],
  "changes": [
    "Wave 1: overview rewritten (reader and prerequisites, sequence rationale, shared conventions); fifth objective added for entry 5; description shortened to 143 characters",
    "Wave 2 (S1, S2, optional): the 2025-edition note limited to the one change the second entry states (qualified Instruction List wording); Foundations of Control Systems linked"
  ],
  "reviewers": [
    "author (wave 1 revision and resolution)",
    "independent reviewer (fact-check, technical, series)",
    "QA editor (final gate)"
  ],
  "reportRef": "reviews/industrial-automation.md",
  "notes": "Series stage: independent series review in reviews/industrial-automation.md; all five objectives met by named entries. Overview has no references of its own; its claims are delivered and sourced in the entries. The Vietnamese overview still carries the pre-wave-1 body; marked for retranslation, outside this English verdict.",
  "history": [],
  "total": 28,
  "decision": "publish",
  "problems": []
}
