{
  "schema": "eos-review-record/1",
  "id": "article/oauth-grants-and-client-types",
  "path": "src/content/blog/oauth-grants-and-client-types.mdx",
  "type": "article",
  "title": "OAuth 2.0 Grants and Client Types",
  "hash": "sha256:e8b10dee41b2eb679c1d90950d848f7c1091e757f0ade7d1cee6aaf3b7230610",
  "reviewedAt": "2026-10-15",
  "commit": "8c3dd5b",
  "stages": {
    "developmental": "pass",
    "copy": "pass",
    "factCheck": "pass",
    "technical": "pass",
    "publishing": "pass",
    "qa": "pass"
  },
  "scores": {
    "purpose": 4,
    "structure": 4,
    "accuracy": 4,
    "evidence": 4,
    "language": 3,
    "consistency": 4,
    "publishing": 4
  },
  "critical": [],
  "findings": {
    "blocking": 0,
    "shouldFix": 1,
    "optional": 1,
    "open": 0
  },
  "lint": {
    "error": 0,
    "warning": 0,
    "suggestion": 4
  },
  "notVerified": [
    "RFC bibliographic entries were checked by wave 1 at rfc-editor.org and not re-fetched in wave 2 (consistent with the RFC index)"
  ],
  "changes": [
    "F1: ID-token validation step 3 follows OpenID Connect Core errata set 2 (untrusted audiences rejected; azp checked when present)",
    "T2: 'following OpenID Connect Core' and a note on the TLS alternative to signature checking",
    "Wave 1: Section 2.3 cites RFC 10017 (published August 2026) instead of ongoing guidance; opening names RFC 6749 as amended by RFC 9700"
  ],
  "reviewers": [
    "author (wave 1 revision and resolution)",
    "independent reviewer (fact-check, technical, series)",
    "QA editor (final gate)"
  ],
  "reportRef": "reviews/identity-and-access-control.md",
  "notes": "Language 3: a few serial commas against standards 5.1 (eos serial-comma suggestions; QA spot-check confirmed genuine lapses), e.g. line 227.",
  "history": [],
  "total": 27,
  "decision": "publish",
  "problems": []
}
