{
  "schema": "eos-review-record/1",
  "id": "article/gaussian-mean-field-variational-inference",
  "path": "src/content/blog/gaussian-mean-field-variational-inference.mdx",
  "type": "article",
  "title": "Gaussian Mean-Field Variational Inference",
  "hash": "sha256:f7b92b592181c240f9b8526918f4f677c46513cd912d8810adce9fd498d72c42",
  "reviewedAt": "2026-10-23",
  "commit": "79b820a",
  "stages": {
    "developmental": "pass",
    "copy": "pass",
    "factCheck": "pass",
    "technical": "pass",
    "publishing": "pass",
    "qa": "pass"
  },
  "scores": {
    "purpose": 4,
    "structure": 4,
    "accuracy": 4,
    "evidence": 3,
    "language": 4,
    "consistency": 4,
    "publishing": 4
  },
  "critical": [],
  "findings": {
    "blocking": 0,
    "shouldFix": 0,
    "optional": 0,
    "open": 0
  },
  "lint": {
    "error": 0,
    "warning": 3,
    "suggestion": 5
  },
  "notVerified": [
    "Running prose wording beyond the mechanical coverage check and page-by-page read (no character-level diff)",
    "Scientific correctness of the book's own claims (kept as written by design)"
  ],
  "changes": [
    "Full text of the book chapter converted to MDX: citation markers removed at the owner's request, house copyedit (American spelling, no contractions, sentence-case headings), figures redrawn as generated SVG",
    "Independent fidelity QA against the PDF: completeness, every display equation, algorithm and table checked; defects fixed",
    "First-person voice rewritten into neutral voice at the owner's decision (no note added); claims, numbers and order unchanged"
  ],
  "reviewers": [
    "converter (full-text conversion)",
    "independent QA editor (fidelity check against the PDF)"
  ],
  "reportRef": null,
  "notes": "Publication of ACRR's own book chapter in full (owner's instruction, 2026-10-22). Developmental and fact-check stages assess fidelity to the source text, not the book's own claims; likely errors in the book are kept as written and listed for the owner.",
  "history": [],
  "total": 27,
  "decision": "publish",
  "problems": []
}
