{
  "schema": "eos-review-record/1",
  "id": "article/solving-large-linear-systems",
  "path": "src/content/blog/solving-large-linear-systems.mdx",
  "type": "article",
  "title": "Solving Large Linear Systems",
  "hash": "sha256:f287a48434219a00474cebc9b65d37834ce9fcdedd8ab37fdd3133cb2b4fb57b",
  "reviewedAt": "2026-10-15",
  "commit": "3dd5a22",
  "stages": {
    "developmental": "pass",
    "copy": "pass",
    "factCheck": "pass",
    "technical": "pass",
    "publishing": "pass",
    "qa": "pass"
  },
  "scores": {
    "purpose": 4,
    "structure": 4,
    "accuracy": 4,
    "evidence": 3,
    "language": 3,
    "consistency": 4,
    "publishing": 4
  },
  "critical": [],
  "findings": {
    "blocking": 0,
    "shouldFix": 1,
    "optional": 3,
    "open": 0
  },
  "lint": {
    "error": 0,
    "warning": 0,
    "suggestion": 2
  },
  "notVerified": [
    "solving-large-linear-systems.mdx:421-428 - imprint years of Briggs-Henson-McCormick 2000, Davis 2006, Golub-Van Loan 2013, Higham 2002, Saad 2003 not re-fetched in the wave-2 pass"
  ],
  "changes": [
    "Wave 1: Section 4.3 split into three paragraphs; long sentences split; SOR expanded at first use; headings in sentence case; description rewritten; 'D. Bau III' corrected",
    "Wave 2 S1: T defined as tridiag(-1, 2, -1), identified with entry 1's A (T/h^2) and stated to be the negative of entry 2's T; Section 3.1 eigenvalues 'with their sign reversed'; Exercise 3 reworded",
    "Wave 2 T1: CG bound stated as a reduction 'by a factor of 10^8'",
    "Wave 2 T2: CG optimality stated over U(0) + Krylov subspace"
  ],
  "reviewers": [
    "author (wave 1 revision and resolution)",
    "independent reviewer (fact-check, technical, series)",
    "QA editor (final gate)"
  ],
  "reportRef": "reviews/numerical-simulation.md",
  "notes": "Evidence 3: book imprints not re-fetched. Language 3: Exercise 3 (line 377) now has two parentheticals in a row after the S1 fix (QA observation Q1). Lint suggestions (one 46-word sentence; SIAM) justified in the wave-1 log.",
  "history": [],
  "total": 26,
  "decision": "publish",
  "problems": []
}
