{
  "schema": "eos-review-record/1",
  "id": "article/noise-interference-and-limits-of-detection",
  "path": "src/content/blog/noise-interference-and-limits-of-detection.mdx",
  "type": "article",
  "title": "Noise, Interference and the Limits of Detection",
  "hash": "sha256:4b896762485e2167d99ade6183fa651287301479a801b208267855a5bd67d49d",
  "reviewedAt": "2026-10-15",
  "commit": "bc55aaa",
  "stages": {
    "developmental": "pass",
    "copy": "pass",
    "factCheck": "pass",
    "technical": "pass",
    "publishing": "pass",
    "qa": "pass"
  },
  "scores": {
    "purpose": 4,
    "structure": 4,
    "accuracy": 4,
    "evidence": 4,
    "language": 4,
    "consistency": 4,
    "publishing": 4
  },
  "critical": [],
  "findings": {
    "blocking": 0,
    "shouldFix": 2,
    "optional": 0,
    "open": 0
  },
  "lint": {
    "error": 0,
    "warning": 0,
    "suggestion": 4
  },
  "notVerified": [
    "References - bibliographic details of Horowitz and Hill, The Art of Electronics, 3rd ed., were not looked up online in the review session"
  ],
  "changes": [
    "Wave 1: 1/f corner renamed f_nc so f_c means only the filter cut-off; ground-loop paragraph rewritten; description and headings",
    "T1: the shared NoiseDensity figure regenerated with the label f_nc (scripts/generate-diagrams.py); verified on the built page",
    "S1: next-entry transition now 'built together in one package'"
  ],
  "reviewers": [
    "author (wave 1 revision and resolution)",
    "independent reviewer (fact-check, technical, series)",
    "QA editor (final gate)"
  ],
  "reportRef": "reviews/sensor-systems.md",
  "notes": "The Vietnamese entry 5 still writes the 1/f corner as f_c in its prose while the shared figure now says f_nc; translation follow-up outside this verdict.",
  "history": [],
  "total": 28,
  "decision": "publish",
  "problems": []
}
