{
  "schema": "eos-review-record/1",
  "id": "article/sequential-monte-carlo-samplers",
  "path": "src/content/blog/sequential-monte-carlo-samplers.mdx",
  "type": "article",
  "title": "Sequential Monte Carlo Samplers",
  "hash": "sha256:16c92a9f73727a219eaee9aa99f50f25d770a7d631b1e0f6766d61cd36053140",
  "reviewedAt": "2026-10-22",
  "commit": "a4650ce",
  "stages": {
    "developmental": "pass",
    "copy": "pass",
    "factCheck": "pass",
    "technical": "pass",
    "publishing": "pass",
    "qa": "pass"
  },
  "scores": {
    "purpose": 4,
    "structure": 4,
    "accuracy": 4,
    "evidence": 3,
    "language": 4,
    "consistency": 4,
    "publishing": 4
  },
  "critical": [],
  "findings": {
    "blocking": 0,
    "shouldFix": 0,
    "optional": 0,
    "open": 0
  },
  "lint": {
    "error": 0,
    "warning": 4,
    "suggestion": 26
  },
  "notVerified": [
    "Mapping of the book text's 'blue' and 'red' credible-set curves to SMC/MLSMC (book figures 4.1 and 4.2 are greyscale vectors with no color)",
    "Figure 4.3 ±3 standard-error bars not redrawn (overlapping bars cannot be attributed to individual methods)",
    "Plot values in Figures 4.1 to 4.4 are approximate readings off the book's plots"
  ],
  "changes": [
    "Full text of the book chapter converted to MDX: citation markers removed at the owner's request, house copyedit (American spelling, no contractions, sentence-case headings), figures redrawn as generated SVG",
    "Independent fidelity QA against the PDF: completeness, every display equation, algorithm and table checked; defects fixed",
    "First-person voice rewritten into neutral voice at the owner's decision (no note added); claims, numbers and order unchanged"
  ],
  "reviewers": [
    "converter (full-text conversion)",
    "independent QA editor (fidelity check against the PDF)"
  ],
  "reportRef": null,
  "notes": "Publication of ACRR's own book chapter in full (owner's instruction, 2026-10-22). Developmental and fact-check stages assess fidelity to the source text, not the book's own claims; likely errors in the book are kept as written and listed for the owner.",
  "history": [
    {
      "reviewedAt": "2026-10-22",
      "hash": "sha256:08373973216dcd8d008201118c524b44084a1cae2eab99e7d2229211401d670a",
      "decision": "publish",
      "total": 27,
      "commit": "cc30b8c"
    }
  ],
  "total": 27,
  "decision": "publish",
  "problems": []
}
